{
  "slice_id": "gc9-s2",
  "catalog_id": "culture-catalog/gc9-s2",
  "subject_id": "player.nacre",
  "subject_entity_id": "entity.relay-7",
  "world_cycle": 8,
  "events": [
    {
      "event_id": "e1",
      "event_type": "ENTITY_UPDATE",
      "cycle": 1,
      "sequence": 1,
      "actor_id": "player.nacre",
      "payload": {
        "entity_id": "entity.relay-7",
        "operation": "REPAIR"
      }
    },
    {
      "event_id": "e2",
      "event_type": "ENTITY_UPDATE",
      "cycle": 3,
      "sequence": 2,
      "actor_id": "player.nacre",
      "payload": {
        "entity_id": "entity.relay-7",
        "operation": "REPAIR"
      }
    },
    {
      "event_id": "e3",
      "event_type": "ENTITY_UPDATE",
      "cycle": 5,
      "sequence": 3,
      "actor_id": "player.nacre",
      "payload": {
        "entity_id": "entity.relay-7",
        "operation": "REPAIR"
      }
    },
    {
      "event_id": "e4",
      "event_type": "ENTITY_UPDATE",
      "cycle": 7,
      "sequence": 4,
      "actor_id": "player.oriole",
      "payload": {
        "entity_id": "entity.relay-7",
        "operation": "REPAIR"
      }
    }
  ],
  "reconstructions": [
    {
      "reconstruction_id": "recon.held",
      "visibility": "PUBLIC",
      "subject_ref": "entity.relay-7",
      "claim": "The relay was held.",
      "epistemic": "OPEN",
      "author_id": "player.nacre"
    },
    {
      "reconstruction_id": "recon.abandoned",
      "visibility": "PUBLIC",
      "subject_ref": "entity.relay-7",
      "claim": "The relay was abandoned.",
      "epistemic": "OPEN",
      "author_id": "player.oriole"
    }
  ],
  "expected": {
    "play_lines": [
      "This site has a maintenance tradition.",
      "Accounts of this site differ.",
      "This site's maintenance tradition has outlived its founders.",
      "Practitioners of this site keep rival accounts."
    ],
    "watch_lines": [
      "A maintenance custom has become widely observed.",
      "A practice has outlived its founders.",
      "Practice at a site has divided."
    ],
    "state": "TRADITION",
    "inherited": true,
    "schism": true,
    "non_derivation": [],
    "ledger_mutated": false,
    "bonus": false,
    "note": "Two practitioners of the same site keep rival public accounts of it."
  }
}
